results/model_comparison.csv

ML Model Name,Accuracy,AUC,Precision,Recall,F1,MCC
Logistic Regression,0.8612,0.8081,0.5104,0.2737,0.3564,0.3039
Decision Tree,0.9176,0.8352,0.7011,0.7207,0.7107,0.6628
KNN,0.8933,0.8141,0.8413,0.2961,0.438,0.46
Naive Bayes,0.5922,0.6604,0.2065,0.6704,0.3158,0.1742
Support Vector Machine,0.9161,0.8986,0.883,0.4637,0.6081,0.6031

README.md

# ML---Assignment--2-

Logistic Regression achieved an accuracy of 86.12% and an AUC score of 0.8081. However, its recall of 27.37% indicates that it failed to identify a considerable proportion of actual churn customers.

Decision Tree achieved an accuracy of 91.76% and the highest F1 score of 0.7107 among all five models. It also achieved the highest recall and MCC, indicating a comparatively balanced performance in identifying churn and non-churn customers.

KNN achieved a precision of 84.13%, indicating good reliability when predicting churn. However, its recall was relatively low at 29.61%, meaning that it missed many actual churn customers.

Naive Bayes achieved a recall of 67.04%, but its precision was only 20.65%. This indicates that although it identified many actual churn customers, it also generated a high number of false positive predictions.

SVM achieved the highest AUC score of 0.8986 and the highest precision of 88.30%. However, its recall of 46.37% indicates that it missed a significant proportion of actual churn customers.